authors,title,subtitle,publishedDate,publisher,contentVersion,averageRating,ratingsCount,description,textSnippet
Nancy Atherton,Aunt Dimity Takes a Holiday,,2004-01-27,Penguin,0.0.1.0.preview.2,4.0,4.0,"The eighth installment of the beloved and bestselling Aunt Dimity series. Watch out for Nancy Atherton's latest, Aunt Dimity and the Widow's Curse, coming in May 2017 from Viking! When Lori Shepherd’s husband, Bill, is summoned to the reading of a will at the resplendent country estate of Earl Elstyn, Lori jumps at the chance to come along. She didn’t expect, however, to find herself entangled in a messy—and dangerous—family dispute. The aristocratic earl has called together the entire Elstyn family to disclose the beneficiaries of his fortune, and all present will be affected. But someone has a grudge against the Elstyns and will stop at nothing for revenge. A burning topiary, a suspicious maid, family secrets, and threatening notes lead Lori to seek her phantom Aunt Dimity’s help in identifying the culprit before he or she can torch the whole house—with the guests in it. From the Paperback edition.","The eighth installment of the beloved and bestselling Aunt Dimity series. Watch out for Nancy Atherton&#39;s latest, Aunt Dimity and the King&#39;s Ransom, coming in July 2018 from Viking!"
Nancy Atherton,Aunt Dimity: Snowbound,,2004-01-26,Penguin,0.3.4.0.preview.2,,,"Lori Shepherd and the phantom Aunt Dimity have become one of the mystery genre’s most celebrated detective duos. Watch out for Nancy Atherton's latest, Aunt Dimity and the Widow's Curse, coming in May 2017 from Viking! In their latest adventure, a pleasant woodland stroll through the English countryside is rudely cut short by the blizzard of the century, forcing Lori to take shelter in Ladythorne Abbey—an old pile still haunted by the presence of the madwoman whose prison it once was. But the abbey’s greatest secret is the priceless jewel it conceals somewhere within its cloisters—an heirloom that hides a treacherous past that Lori’s fellow guests can’t wait to get their hands on. Only Aunt Dimity’s indispensable wisdom can help Lori unravel a mystery that is considerably thicker than the accumulating snow in this page-turning treat. From the Paperback edition.","Lori Shepherd and the phantom Aunt Dimity have become one of the mystery genre’s most celebrated detective duos. Watch out for Nancy Atherton&#39;s latest, Aunt Dimity and the King&#39;s Ransom, coming in July 2018 from Viking!"
Jacqueline Winspear,Maisie Dobbs,,2003-07-01,Soho Press,1.6.5.0.preview.3,3.5,129.0,"""A female investigator every bit as brainy and battle-hardened as Lisbeth Salander."" —Maureen Corrigan, NPR's Fresh Air, on Maisie Dobbs Maisie Dobbs got her start as a maid in an aristocratic London household when she was thirteen. Her employer, suffragette Lady Rowan Compton, soon became her patron, taking the remarkably bright youngster under her wing. Lady Rowan's friend, Maurice Blanche, often retained as an investigator by the European elite, recognized Maisie’s intuitive gifts and helped her earn admission to the prestigious Girton College in Cambridge, where Maisie planned to complete her education. The outbreak of war changed everything. Maisie trained as a nurse, then left for France to serve at the Front, where she found—and lost—an important part of herself. Ten years after the Armistice, in the spring of 1929, Maisie sets out on her own as a private investigator, one who has learned that coincidences are meaningful, and truth elusive. Her very first case involves suspected infidelity but reveals something very different. In the aftermath of the Great War, a former officer has founded a working farm known as The Retreat, that acts as a convalescent refuge for ex-soldiers too shattered to resume normal life. When Fate brings Maisie a second case involving The Retreat, she must finally confront the ghost that has haunted her for over a decade.","&quot;A female investigator every bit as brainy and battle-hardened as Lisbeth Salander.&quot; —Maureen Corrigan, NPR&#39;s Fresh Air, on Maisie Dobbs Maisie Dobbs got her start as a maid in an aristocratic London household when she was thirteen."
Nancy Atherton,Aunt Dimity Beats the Devil,,2001-10-01,Penguin,1.4.1.0.preview.2,3.5,14.0,"The charming sixth installment of the bestselling Aunt Dimity series. Watch out for Nancy Atherton's latest, Aunt Dimity and the Widow's Curse, coming in May 2017 from Viking! With rain crashing down on her Range Rover, as it climbs up a steep embankment on the Northumberland moors, Lori Shepherd is beginning to doubt the wisdom of her decision to evaluate a rare book collection at Wyrdhurst Hall. The grim, neo-gothic hall that greets her upon arrival is full of surprises-including a charming, secretive stranger, and a cache of World War I letters that tell a tale of doomed love and hint at a hidden treasure. It will take all of Dimity's supernatural skills to help Lori solve the puzzle and restore peace to a family haunted by its tragic past. From the Paperback edition.","The charming sixth installment of the bestselling Aunt Dimity series. Watch out for Nancy Atherton&#39;s latest, Aunt Dimity and the King&#39;s Ransom, coming in July 2018 from Viking!"
Nancy Atherton,Aunt Dimity Digs In,,1999-03-01,Penguin,0.3.4.0.preview.2,3.0,8.0,"Watch out for Nancy Atherton's latest, Aunt Dimity and the Widow's Curse, coming in May 2017 from Viking! The latest in this enchanting and fast-selling series, featuring the beloved ghost Aunt Dimity, opens in a picturesque English cottage where the lovable Lori Shepherd is up to her elbows in pureed carrots and formula bottles, striving to be the perfect mother to twins! Luckily, a beautiful Italian nanny arrives just in time--so Lori can help settle the local civil war stirred up by a visiting archaeologist's excavation. With Reginald, the stuffed pink rabbit and Edmond Terrance, the stuffed tiger in tow, Lori hunts down a missing document, and the archaeologist digs up a lot more than artifacts. It is Aunt Dimity's magic blue notebook that provides the key to buried secrets and domestic malice, and shows all the residents of Finch that even the darkest acts can be overcome by forgiveness. From the Paperback edition.","Watch out for Nancy Atherton&#39;s latest, Aunt Dimity and the King&#39;s Ransom, coming in July 2018 from Viking!"
Nancy Atherton,Aunt Dimity's Death,,1993-11-01,Penguin,2.6.5.0.preview.2,3.0,39.0,"The debut that kicked off twenty-two books (and counting...) of the bestselling, beloved Aunt Dimity series. Watch out for Nancy Atherton's latest, Aunt Dimity and the King's Ransom, coming in July 2018 from Viking! Lori Shepherd thought Aunt Dimity was just a character in a bedtime story... ...Until the Dickensian law firm of Willis & Willis summons her to a reading of the woman's will. Down-on-her-luck Lori learns she's about to inherit a siazable estate--if she can discover the secret hidden in a treasure trove of letters in Dimity's English country cottage. What begins as a fairy tale becomes a mystery--and a ghost story--in an improbably cozy setting, as Aunt Dimity's indominable spirit leads Lori on an otherworldly quest to discover how, in this life, true love can conquer all.","The debut that kicked off twenty-two books (and counting...) of the bestselling, beloved Aunt Dimity series. Watch out for Nancy Atherton&#39;s latest, Aunt Dimity and the King&#39;s Ransom, coming in July 2018 from Viking!"
Michel Bataille,The Christmas Tree,,1969,,preview-1.0.0,,,,Maisie Dobbs takes on her first investigation in 1920s London
